{
 "schema": "reuse-event/v1",
 "reuse_event_id": "rev-neutral",
 "run": {
  "run_id": "run-1",
  "sha256": "6666666666666666666666666666666666666666666666666666666666666666"
 },
 "pattern": {
  "pattern_id": "pat-minimal",
  "sha256": "7777777777777777777777777777777777777777777777777777777777777777"
 },
 "outcome": "neutral",
 "recorded_at": "2026-08-17T09:20:00Z"
}
